{
  "$schema": "./schema/engines.schema.json",
  "schemaVersion": 1,
  "updated": "2026-08-21",
  "notes": "Detection rules are declarative. Each matching rule contributes its `score`; an engine is a candidate when its total >= minScore. Highest total wins, ties broken by `priority`. A rule with `capture` stores its match under that name so later rules of the same engine can reference it as $name.",
  "engines": [
    {
      "id": "unity",
      "name": "Unity",
      "family": "unity",
      "priority": 90,
      "minScore": 60,
      "rules": [
        {
          "kind": "file",
          "value": "UnityPlayer.dll",
          "score": 60,
          "note": "Unity 5.4+ standalone player runtime"
        },
        {
          "kind": "dirSuffix",
          "value": "_Data",
          "score": 45,
          "capture": "dataDir",
          "note": "<GameName>_Data payload folder, present in every Windows Unity build"
        },
        {
          "kind": "fileUnder",
          "dir": "$dataDir",
          "value": "globalgamemanagers",
          "score": 25
        },
        {
          "kind": "fileUnder",
          "dir": "$dataDir",
          "value": "data.unity3d",
          "score": 25,
          "note": "Unity 2019+ single-bundle builds ship this instead of globalgamemanagers"
        },
        {
          "kind": "dir",
          "value": "MonoBleedingEdge",
          "score": 15,
          "note": "Mono scripting backend runtime"
        },
        {
          "kind": "file",
          "value": "GameAssembly.dll",
          "score": 15,
          "note": "IL2CPP scripting backend"
        },
        {
          "kind": "fileAny",
          "value": [
            "UnityCrashHandler64.exe",
            "UnityCrashHandler32.exe"
          ],
          "score": 10
        }
      ],
      "probes": [
        "unityBackend",
        "unityVersion",
        "peArch"
      ],
      "loaders": [
        "bepinex5",
        "bepinex6-mono",
        "bepinex6-il2cpp",
        "melonloader",
        "unity-mod-manager",
        "reipatcher"
      ],
      "translators": [
        "xunity-autotranslator",
        "mort",
        "lunatranslator",
        "mtool",
        "translator-plus-plus"
      ]
    },
    {
      "id": "renpy",
      "name": "RenPy",
      "displayName": "Ren'Py",
      "family": "python",
      "priority": 85,
      "minScore": 60,
      "rules": [
        {
          "kind": "dir",
          "value": "renpy",
          "score": 50
        },
        {
          "kind": "dir",
          "value": "game",
          "score": 20
        },
        {
          "kind": "dir",
          "value": "lib",
          "score": 10
        },
        {
          "kind": "fileUnder",
          "dir": "renpy",
          "value": "__init__.py",
          "score": 20
        },
        {
          "kind": "extUnder",
          "dir": "game",
          "value": ".rpa",
          "score": 15
        },
        {
          "kind": "extUnder",
          "dir": "game",
          "value": ".rpyc",
          "score": 15
        },
        {
          "kind": "exeSiblingExt",
          "value": ".py",
          "score": 15,
          "note": "Ships GameName.exe next to GameName.py"
        }
      ],
      "probes": [
        "renpyVersion",
        "peArch"
      ],
      "loaders": [
        "renpy-native"
      ],
      "translators": [
        "renpy-translator",
        "projz-renpy-translation",
        "mort",
        "lunatranslator",
        "translator-plus-plus"
      ]
    },
    {
      "id": "rpgmaker-mz",
      "name": "RPG Maker MZ",
      "family": "nwjs",
      "priority": 80,
      "minScore": 60,
      "rules": [
        {
          "kind": "fileAny",
          "value": [
            "js/rmmz_core.js",
            "www/js/rmmz_core.js"
          ],
          "score": 70
        },
        {
          "kind": "fileAny",
          "value": [
            "package.json",
            "www/package.json"
          ],
          "score": 10
        },
        {
          "kind": "fileAny",
          "value": [
            "nw.dll",
            "node.dll"
          ],
          "score": 10
        },
        {
          "kind": "dirAny",
          "value": [
            "data",
            "www/data"
          ],
          "score": 10
        }
      ],
      "probes": [
        "rpgmakerInfo",
        "nwjsVersion",
        "peArch"
      ],
      "loaders": [
        "rpgmaker-plugins"
      ],
      "translators": [
        "mtool",
        "translator-plus-plus",
        "rpgmaker-mvmz-translator",
        "mort",
        "lunatranslator"
      ]
    },
    {
      "id": "rpgmaker-mv",
      "name": "RPG Maker MV",
      "family": "nwjs",
      "priority": 79,
      "minScore": 60,
      "rules": [
        {
          "kind": "fileAny",
          "value": [
            "js/rpg_core.js",
            "www/js/rpg_core.js"
          ],
          "score": 70
        },
        {
          "kind": "fileAny",
          "value": [
            "package.json",
            "www/package.json"
          ],
          "score": 10
        },
        {
          "kind": "fileAny",
          "value": [
            "nw.dll",
            "node.dll"
          ],
          "score": 10
        },
        {
          "kind": "dirAny",
          "value": [
            "data",
            "www/data"
          ],
          "score": 10
        }
      ],
      "probes": [
        "rpgmakerInfo",
        "nwjsVersion",
        "peArch"
      ],
      "loaders": [
        "rpgmaker-plugins"
      ],
      "translators": [
        "mtool",
        "translator-plus-plus",
        "rpgmaker-mvmz-translator",
        "mort",
        "lunatranslator"
      ]
    },
    {
      "id": "rpgmaker-rgss",
      "name": "RPG Maker XP/VX/VX Ace",
      "family": "rgss",
      "priority": 78,
      "minScore": 55,
      "rules": [
        {
          "kind": "file",
          "value": "Game.ini",
          "score": 20
        },
        {
          "kind": "extUnder",
          "dir": "Data",
          "value": ".rvdata2",
          "score": 60,
          "capture": "rgssAce"
        },
        {
          "kind": "extUnder",
          "dir": "Data",
          "value": ".rvdata",
          "score": 55,
          "capture": "rgssVx"
        },
        {
          "kind": "extUnder",
          "dir": "Data",
          "value": ".rxdata",
          "score": 55,
          "capture": "rgssXp"
        },
        {
          "kind": "extRoot",
          "value": ".rgss3a",
          "score": 40
        },
        {
          "kind": "extRoot",
          "value": ".rgss2a",
          "score": 35
        },
        {
          "kind": "extRoot",
          "value": ".rgssad",
          "score": 35
        },
        {
          "kind": "fileGlob",
          "value": "RGSS*.dll",
          "score": 25
        }
      ],
      "probes": [
        "rgssVariant",
        "peArch"
      ],
      "loaders": [
        "rgss-script-injection"
      ],
      "translators": [
        "translator-plus-plus",
        "mort",
        "lunatranslator",
        "textractor",
        "mtool"
      ]
    },
    {
      "id": "wolf-rpg",
      "name": "Wolf RPG Editor",
      "family": "wolf",
      "priority": 77,
      "minScore": 55,
      "rules": [
        {
          "kind": "fileAny",
          "value": [
            "Data/BasicData/Game.dat",
            "data/BasicData/Game.dat"
          ],
          "score": 60
        },
        {
          "kind": "extRoot",
          "value": ".wolf",
          "score": 45
        },
        {
          "kind": "file",
          "value": "GuruguruSMF4.dll",
          "score": 30
        },
        {
          "kind": "fileAny",
          "value": [
            "Config.exe",
            "Game.exe"
          ],
          "score": 10
        }
      ],
      "probes": [
        "peArch"
      ],
      "loaders": [],
      "translators": [
        "wolftrans",
        "mort",
        "lunatranslator",
        "textractor",
        "mtool",
        "translator-plus-plus"
      ]
    },
    {
      "id": "godot",
      "name": "Godot Engine",
      "family": "godot",
      "priority": 75,
      "minScore": 55,
      "rules": [
        {
          "kind": "extRoot",
          "value": ".pck",
          "score": 55
        },
        {
          "kind": "exeSiblingSuffix",
          "value": ".console.exe",
          "score": 45,
          "note": "Godot 4.2+ exports a paired console executable"
        },
        {
          "kind": "fileGlob",
          "value": "libgodot*",
          "score": 25
        },
        {
          "kind": "fileGlob",
          "value": "*godot*.dll",
          "score": 20
        }
      ],
      "probes": [
        "godotVersion",
        "peArch"
      ],
      "loaders": [
        "gdweave"
      ],
      "translators": [
        "mort",
        "lunatranslator"
      ]
    },
    {
      "id": "gamemaker",
      "name": "GameMaker (Studio 1/2/LTS)",
      "family": "gamemaker",
      "priority": 74,
      "minScore": 55,
      "rules": [
        {
          "kind": "file",
          "value": "data.win",
          "score": 70
        },
        {
          "kind": "fileGlob",
          "value": "audiogroup*.dat",
          "score": 20
        },
        {
          "kind": "file",
          "value": "options.ini",
          "score": 10
        }
      ],
      "probes": [
        "peArch"
      ],
      "loaders": [
        "undertale-mod-tool"
      ],
      "translators": [
        "mort",
        "lunatranslator"
      ]
    },
    {
      "id": "unreal",
      "name": "Unreal Engine",
      "family": "unreal",
      "priority": 73,
      "minScore": 55,
      "rules": [
        {
          "kind": "dir",
          "value": "Engine/Binaries/Win64",
          "score": 45
        },
        {
          "kind": "fileGlob",
          "value": "*-Win64-Shipping.exe",
          "score": 40,